{
  "schema_version": "lab-host-evidence-v1",
  "host_manifest": {
    "schema_version": "lab-host-manifest-v1",
    "host_id": "macos-ref",
    "platform": "macos-arm64",
    "backend": "metal",
    "os_build": "fixture",
    "cpu": "",
    "gpu": "",
    "attested": true
  },
  "archive_sha256": "pending",
  "remote_archive_verified": true,
  "raw_trials": [
    {
      "agent_count": 50000,
      "trial_index": 0,
      "frame_service_ms": [
        9.5,
        9.5,
        9.5,
        9.5,
        9.5,
        9.5,
        9.5,
        9.5,
        9.5,
        9.5,
        9.5,
        9.5,
        9.5,
        9.5,
        9.5,
        9.5,
        9.5,
        9.5,
        9.5,
        9.5,
        9.5,
        9.5,
        9.5,
        9.5,
        9.5,
        9.5,
        9.5,
        9.5,
        9.5,
        9.5,
        9.5,
        9.5,
        9.5,
        9.5,
        9.5,
        9.5,
        9.5,
        9.5,
        9.5,
        9.5,
        9.5,
        9.5,
        9.5,
        9.5,
        9.5,
        9.5,
        9.5,
        9.5,
        9.5,
        9.5,
        9.5,
        9.5,
        9.5,
        9.5,
        9.5,
        9.5,
        9.5,
        9.5,
        9.5,
        9.5,
        9.5,
        9.5,
        9.5,
        9.5
      ]
    },
    {
      "agent_count": 50000,
      "trial_index": 1,
      "frame_service_ms": [
        9.52,
        9.52,
        9.52,
        9.52,
        9.52,
        9.52,
        9.52,
        9.52,
        9.52,
        9.52,
        9.52,
        9.52,
        9.52,
        9.52,
        9.52,
        9.52,
        9.52,
        9.52,
        9.52,
        9.52,
        9.52,
        9.52,
        9.52,
        9.52,
        9.52,
        9.52,
        9.52,
        9.52,
        9.52,
        9.52,
        9.52,
        9.52,
        9.52,
        9.52,
        9.52,
        9.52,
        9.52,
        9.52,
        9.52,
        9.52,
        9.52,
        9.52,
        9.52,
        9.52,
        9.52,
        9.52,
        9.52,
        9.52,
        9.52,
        9.52,
        9.52,
        9.52,
        9.52,
        9.52,
        9.52,
        9.52,
        9.52,
        9.52,
        9.52,
        9.52,
        9.52,
        9.52,
        9.52,
        9.52
      ]
    },
    {
      "agent_count": 50000,
      "trial_index": 2,
      "frame_service_ms": [
        9.54,
        9.54,
        9.54,
        9.54,
        9.54,
        9.54,
        9.54,
        9.54,
        9.54,
        9.54,
        9.54,
        9.54,
        9.54,
        9.54,
        9.54,
        9.54,
        9.54,
        9.54,
        9.54,
        9.54,
        9.54,
        9.54,
        9.54,
        9.54,
        9.54,
        9.54,
        9.54,
        9.54,
        9.54,
        9.54,
        9.54,
        9.54,
        9.54,
        9.54,
        9.54,
        9.54,
        9.54,
        9.54,
        9.54,
        9.54,
        9.54,
        9.54,
        9.54,
        9.54,
        9.54,
        9.54,
        9.54,
        9.54,
        9.54,
        9.54,
        9.54,
        9.54,
        9.54,
        9.54,
        9.54,
        9.54,
        9.54,
        9.54,
        9.54,
        9.54,
        9.54,
        9.54,
        9.54,
        9.54
      ]
    },
    {
      "agent_count": 50000,
      "trial_index": 3,
      "frame_service_ms": [
        9.56,
        9.56,
        9.56,
        9.56,
        9.56,
        9.56,
        9.56,
        9.56,
        9.56,
        9.56,
        9.56,
        9.56,
        9.56,
        9.56,
        9.56,
        9.56,
        9.56,
        9.56,
        9.56,
        9.56,
        9.56,
        9.56,
        9.56,
        9.56,
        9.56,
        9.56,
        9.56,
        9.56,
        9.56,
        9.56,
        9.56,
        9.56,
        9.56,
        9.56,
        9.56,
        9.56,
        9.56,
        9.56,
        9.56,
        9.56,
        9.56,
        9.56,
        9.56,
        9.56,
        9.56,
        9.56,
        9.56,
        9.56,
        9.56,
        9.56,
        9.56,
        9.56,
        9.56,
        9.56,
        9.56,
        9.56,
        9.56,
        9.56,
        9.56,
        9.56,
        9.56,
        9.56,
        9.56,
        9.56
      ]
    },
    {
      "agent_count": 50000,
      "trial_index": 4,
      "frame_service_ms": [
        9.58,
        9.58,
        9.58,
        9.58,
        9.58,
        9.58,
        9.58,
        9.58,
        9.58,
        9.58,
        9.58,
        9.58,
        9.58,
        9.58,
        9.58,
        9.58,
        9.58,
        9.58,
        9.58,
        9.58,
        9.58,
        9.58,
        9.58,
        9.58,
        9.58,
        9.58,
        9.58,
        9.58,
        9.58,
        9.58,
        9.58,
        9.58,
        9.58,
        9.58,
        9.58,
        9.58,
        9.58,
        9.58,
        9.58,
        9.58,
        9.58,
        9.58,
        9.58,
        9.58,
        9.58,
        9.58,
        9.58,
        9.58,
        9.58,
        9.58,
        9.58,
        9.58,
        9.58,
        9.58,
        9.58,
        9.58,
        9.58,
        9.58,
        9.58,
        9.58,
        9.58,
        9.58,
        9.58,
        9.58
      ]
    },
    {
      "agent_count": 50000,
      "trial_index": 5,
      "frame_service_ms": [
        9.6,
        9.6,
        9.6,
        9.6,
        9.6,
        9.6,
        9.6,
        9.6,
        9.6,
        9.6,
        9.6,
        9.6,
        9.6,
        9.6,
        9.6,
        9.6,
        9.6,
        9.6,
        9.6,
        9.6,
        9.6,
        9.6,
        9.6,
        9.6,
        9.6,
        9.6,
        9.6,
        9.6,
        9.6,
        9.6,
        9.6,
        9.6,
        9.6,
        9.6,
        9.6,
        9.6,
        9.6,
        9.6,
        9.6,
        9.6,
        9.6,
        9.6,
        9.6,
        9.6,
        9.6,
        9.6,
        9.6,
        9.6,
        9.6,
        9.6,
        9.6,
        9.6,
        9.6,
        9.6,
        9.6,
        9.6,
        9.6,
        9.6,
        9.6,
        9.6,
        9.6,
        9.6,
        9.6,
        9.6
      ]
    },
    {
      "agent_count": 50000,
      "trial_index": 6,
      "frame_service_ms": [
        9.62,
        9.62,
        9.62,
        9.62,
        9.62,
        9.62,
        9.62,
        9.62,
        9.62,
        9.62,
        9.62,
        9.62,
        9.62,
        9.62,
        9.62,
        9.62,
        9.62,
        9.62,
        9.62,
        9.62,
        9.62,
        9.62,
        9.62,
        9.62,
        9.62,
        9.62,
        9.62,
        9.62,
        9.62,
        9.62,
        9.62,
        9.62,
        9.62,
        9.62,
        9.62,
        9.62,
        9.62,
        9.62,
        9.62,
        9.62,
        9.62,
        9.62,
        9.62,
        9.62,
        9.62,
        9.62,
        9.62,
        9.62,
        9.62,
        9.62,
        9.62,
        9.62,
        9.62,
        9.62,
        9.62,
        9.62,
        9.62,
        9.62,
        9.62,
        9.62,
        9.62,
        9.62,
        9.62,
        9.62
      ]
    }
  ],
  "claimed": {
    "median_p95_ms": 9.56,
    "median_p99_ms": 9.56,
    "verdict": "pass"
  },
  "project_rust_alloc_count": 0,
  "submitted_frames": 100,
  "completed_frames": 100,
  "max_in_flight": 2
}
