{
  "schema_version": "lab-host-evidence-v1",
  "host_manifest": {
    "schema_version": "lab-host-manifest-v1",
    "host_id": "windows-ref",
    "platform": "windows-x86_64",
    "backend": "d3d12",
    "os_build": "fixture",
    "cpu": "",
    "gpu": "",
    "attested": true
  },
  "archive_sha256": "pending",
  "remote_archive_verified": true,
  "raw_trials": [
    {
      "agent_count": 50000,
      "trial_index": 0,
      "frame_service_ms": [
        11.0,
        11.0,
        11.0,
        11.0,
        11.0,
        11.0,
        11.0,
        11.0,
        11.0,
        11.0,
        11.0,
        11.0,
        11.0,
        11.0,
        11.0,
        11.0,
        11.0,
        11.0,
        11.0,
        11.0,
        11.0,
        11.0,
        11.0,
        11.0,
        11.0,
        11.0,
        11.0,
        11.0,
        11.0,
        11.0,
        11.0,
        11.0,
        11.0,
        11.0,
        11.0,
        11.0,
        11.0,
        11.0,
        11.0,
        11.0,
        11.0,
        11.0,
        11.0,
        11.0,
        11.0,
        11.0,
        11.0,
        11.0,
        11.0,
        11.0,
        11.0,
        11.0,
        11.0,
        11.0,
        11.0,
        11.0,
        11.0,
        11.0,
        11.0,
        11.0,
        11.0,
        11.0,
        11.0,
        11.0
      ]
    },
    {
      "agent_count": 50000,
      "trial_index": 1,
      "frame_service_ms": [
        11.02,
        11.02,
        11.02,
        11.02,
        11.02,
        11.02,
        11.02,
        11.02,
        11.02,
        11.02,
        11.02,
        11.02,
        11.02,
        11.02,
        11.02,
        11.02,
        11.02,
        11.02,
        11.02,
        11.02,
        11.02,
        11.02,
        11.02,
        11.02,
        11.02,
        11.02,
        11.02,
        11.02,
        11.02,
        11.02,
        11.02,
        11.02,
        11.02,
        11.02,
        11.02,
        11.02,
        11.02,
        11.02,
        11.02,
        11.02,
        11.02,
        11.02,
        11.02,
        11.02,
        11.02,
        11.02,
        11.02,
        11.02,
        11.02,
        11.02,
        11.02,
        11.02,
        11.02,
        11.02,
        11.02,
        11.02,
        11.02,
        11.02,
        11.02,
        11.02,
        11.02,
        11.02,
        11.02,
        11.02
      ]
    },
    {
      "agent_count": 50000,
      "trial_index": 2,
      "frame_service_ms": [
        11.04,
        11.04,
        11.04,
        11.04,
        11.04,
        11.04,
        11.04,
        11.04,
        11.04,
        11.04,
        11.04,
        11.04,
        11.04,
        11.04,
        11.04,
        11.04,
        11.04,
        11.04,
        11.04,
        11.04,
        11.04,
        11.04,
        11.04,
        11.04,
        11.04,
        11.04,
        11.04,
        11.04,
        11.04,
        11.04,
        11.04,
        11.04,
        11.04,
        11.04,
        11.04,
        11.04,
        11.04,
        11.04,
        11.04,
        11.04,
        11.04,
        11.04,
        11.04,
        11.04,
        11.04,
        11.04,
        11.04,
        11.04,
        11.04,
        11.04,
        11.04,
        11.04,
        11.04,
        11.04,
        11.04,
        11.04,
        11.04,
        11.04,
        11.04,
        11.04,
        11.04,
        11.04,
        11.04,
        11.04
      ]
    },
    {
      "agent_count": 50000,
      "trial_index": 3,
      "frame_service_ms": [
        11.06,
        11.06,
        11.06,
        11.06,
        11.06,
        11.06,
        11.06,
        11.06,
        11.06,
        11.06,
        11.06,
        11.06,
        11.06,
        11.06,
        11.06,
        11.06,
        11.06,
        11.06,
        11.06,
        11.06,
        11.06,
        11.06,
        11.06,
        11.06,
        11.06,
        11.06,
        11.06,
        11.06,
        11.06,
        11.06,
        11.06,
        11.06,
        11.06,
        11.06,
        11.06,
        11.06,
        11.06,
        11.06,
        11.06,
        11.06,
        11.06,
        11.06,
        11.06,
        11.06,
        11.06,
        11.06,
        11.06,
        11.06,
        11.06,
        11.06,
        11.06,
        11.06,
        11.06,
        11.06,
        11.06,
        11.06,
        11.06,
        11.06,
        11.06,
        11.06,
        11.06,
        11.06,
        11.06,
        11.06
      ]
    },
    {
      "agent_count": 50000,
      "trial_index": 4,
      "frame_service_ms": [
        11.08,
        11.08,
        11.08,
        11.08,
        11.08,
        11.08,
        11.08,
        11.08,
        11.08,
        11.08,
        11.08,
        11.08,
        11.08,
        11.08,
        11.08,
        11.08,
        11.08,
        11.08,
        11.08,
        11.08,
        11.08,
        11.08,
        11.08,
        11.08,
        11.08,
        11.08,
        11.08,
        11.08,
        11.08,
        11.08,
        11.08,
        11.08,
        11.08,
        11.08,
        11.08,
        11.08,
        11.08,
        11.08,
        11.08,
        11.08,
        11.08,
        11.08,
        11.08,
        11.08,
        11.08,
        11.08,
        11.08,
        11.08,
        11.08,
        11.08,
        11.08,
        11.08,
        11.08,
        11.08,
        11.08,
        11.08,
        11.08,
        11.08,
        11.08,
        11.08,
        11.08,
        11.08,
        11.08,
        11.08
      ]
    },
    {
      "agent_count": 50000,
      "trial_index": 5,
      "frame_service_ms": [
        11.1,
        11.1,
        11.1,
        11.1,
        11.1,
        11.1,
        11.1,
        11.1,
        11.1,
        11.1,
        11.1,
        11.1,
        11.1,
        11.1,
        11.1,
        11.1,
        11.1,
        11.1,
        11.1,
        11.1,
        11.1,
        11.1,
        11.1,
        11.1,
        11.1,
        11.1,
        11.1,
        11.1,
        11.1,
        11.1,
        11.1,
        11.1,
        11.1,
        11.1,
        11.1,
        11.1,
        11.1,
        11.1,
        11.1,
        11.1,
        11.1,
        11.1,
        11.1,
        11.1,
        11.1,
        11.1,
        11.1,
        11.1,
        11.1,
        11.1,
        11.1,
        11.1,
        11.1,
        11.1,
        11.1,
        11.1,
        11.1,
        11.1,
        11.1,
        11.1,
        11.1,
        11.1,
        11.1,
        11.1
      ]
    },
    {
      "agent_count": 50000,
      "trial_index": 6,
      "frame_service_ms": [
        11.12,
        11.12,
        11.12,
        11.12,
        11.12,
        11.12,
        11.12,
        11.12,
        11.12,
        11.12,
        11.12,
        11.12,
        11.12,
        11.12,
        11.12,
        11.12,
        11.12,
        11.12,
        11.12,
        11.12,
        11.12,
        11.12,
        11.12,
        11.12,
        11.12,
        11.12,
        11.12,
        11.12,
        11.12,
        11.12,
        11.12,
        11.12,
        11.12,
        11.12,
        11.12,
        11.12,
        11.12,
        11.12,
        11.12,
        11.12,
        11.12,
        11.12,
        11.12,
        11.12,
        11.12,
        11.12,
        11.12,
        11.12,
        11.12,
        11.12,
        11.12,
        11.12,
        11.12,
        11.12,
        11.12,
        11.12,
        11.12,
        11.12,
        11.12,
        11.12,
        11.12,
        11.12,
        11.12,
        11.12
      ]
    }
  ],
  "claimed": {
    "median_p95_ms": 11.06,
    "median_p99_ms": 11.06,
    "verdict": "pass"
  },
  "project_rust_alloc_count": 0,
  "submitted_frames": 100,
  "completed_frames": 100,
  "max_in_flight": 2
}
