{
  "schema_version": "lab-host-evidence-v1",
  "host_manifest": {
    "schema_version": "lab-host-manifest-v1",
    "host_id": "ubuntu-ref",
    "platform": "linux-x86_64",
    "backend": "vulkan",
    "os_build": "fixture",
    "cpu": "",
    "gpu": "",
    "attested": true
  },
  "archive_sha256": "pending",
  "remote_archive_verified": true,
  "raw_trials": [
    {
      "agent_count": 50000,
      "trial_index": 0,
      "frame_service_ms": [
        10.0,
        10.0,
        10.0,
        10.0,
        10.0,
        10.0,
        10.0,
        10.0,
        10.0,
        10.0,
        10.0,
        10.0,
        10.0,
        10.0,
        10.0,
        10.0,
        10.0,
        10.0,
        10.0,
        10.0,
        10.0,
        10.0,
        10.0,
        10.0,
        10.0,
        10.0,
        10.0,
        10.0,
        10.0,
        10.0,
        10.0,
        10.0,
        10.0,
        10.0,
        10.0,
        10.0,
        10.0,
        10.0,
        10.0,
        10.0,
        10.0,
        10.0,
        10.0,
        10.0,
        10.0,
        10.0,
        10.0,
        10.0,
        10.0,
        10.0,
        10.0,
        10.0,
        10.0,
        10.0,
        10.0,
        10.0,
        10.0,
        10.0,
        10.0,
        10.0,
        10.0,
        10.0,
        10.0,
        10.0
      ]
    },
    {
      "agent_count": 50000,
      "trial_index": 1,
      "frame_service_ms": [
        10.02,
        10.02,
        10.02,
        10.02,
        10.02,
        10.02,
        10.02,
        10.02,
        10.02,
        10.02,
        10.02,
        10.02,
        10.02,
        10.02,
        10.02,
        10.02,
        10.02,
        10.02,
        10.02,
        10.02,
        10.02,
        10.02,
        10.02,
        10.02,
        10.02,
        10.02,
        10.02,
        10.02,
        10.02,
        10.02,
        10.02,
        10.02,
        10.02,
        10.02,
        10.02,
        10.02,
        10.02,
        10.02,
        10.02,
        10.02,
        10.02,
        10.02,
        10.02,
        10.02,
        10.02,
        10.02,
        10.02,
        10.02,
        10.02,
        10.02,
        10.02,
        10.02,
        10.02,
        10.02,
        10.02,
        10.02,
        10.02,
        10.02,
        10.02,
        10.02,
        10.02,
        10.02,
        10.02,
        10.02
      ]
    },
    {
      "agent_count": 50000,
      "trial_index": 2,
      "frame_service_ms": [
        10.04,
        10.04,
        10.04,
        10.04,
        10.04,
        10.04,
        10.04,
        10.04,
        10.04,
        10.04,
        10.04,
        10.04,
        10.04,
        10.04,
        10.04,
        10.04,
        10.04,
        10.04,
        10.04,
        10.04,
        10.04,
        10.04,
        10.04,
        10.04,
        10.04,
        10.04,
        10.04,
        10.04,
        10.04,
        10.04,
        10.04,
        10.04,
        10.04,
        10.04,
        10.04,
        10.04,
        10.04,
        10.04,
        10.04,
        10.04,
        10.04,
        10.04,
        10.04,
        10.04,
        10.04,
        10.04,
        10.04,
        10.04,
        10.04,
        10.04,
        10.04,
        10.04,
        10.04,
        10.04,
        10.04,
        10.04,
        10.04,
        10.04,
        10.04,
        10.04,
        10.04,
        10.04,
        10.04,
        10.04
      ]
    },
    {
      "agent_count": 50000,
      "trial_index": 3,
      "frame_service_ms": [
        10.06,
        10.06,
        10.06,
        10.06,
        10.06,
        10.06,
        10.06,
        10.06,
        10.06,
        10.06,
        10.06,
        10.06,
        10.06,
        10.06,
        10.06,
        10.06,
        10.06,
        10.06,
        10.06,
        10.06,
        10.06,
        10.06,
        10.06,
        10.06,
        10.06,
        10.06,
        10.06,
        10.06,
        10.06,
        10.06,
        10.06,
        10.06,
        10.06,
        10.06,
        10.06,
        10.06,
        10.06,
        10.06,
        10.06,
        10.06,
        10.06,
        10.06,
        10.06,
        10.06,
        10.06,
        10.06,
        10.06,
        10.06,
        10.06,
        10.06,
        10.06,
        10.06,
        10.06,
        10.06,
        10.06,
        10.06,
        10.06,
        10.06,
        10.06,
        10.06,
        10.06,
        10.06,
        10.06,
        10.06
      ]
    },
    {
      "agent_count": 50000,
      "trial_index": 4,
      "frame_service_ms": [
        10.08,
        10.08,
        10.08,
        10.08,
        10.08,
        10.08,
        10.08,
        10.08,
        10.08,
        10.08,
        10.08,
        10.08,
        10.08,
        10.08,
        10.08,
        10.08,
        10.08,
        10.08,
        10.08,
        10.08,
        10.08,
        10.08,
        10.08,
        10.08,
        10.08,
        10.08,
        10.08,
        10.08,
        10.08,
        10.08,
        10.08,
        10.08,
        10.08,
        10.08,
        10.08,
        10.08,
        10.08,
        10.08,
        10.08,
        10.08,
        10.08,
        10.08,
        10.08,
        10.08,
        10.08,
        10.08,
        10.08,
        10.08,
        10.08,
        10.08,
        10.08,
        10.08,
        10.08,
        10.08,
        10.08,
        10.08,
        10.08,
        10.08,
        10.08,
        10.08,
        10.08,
        10.08,
        10.08,
        10.08
      ]
    },
    {
      "agent_count": 50000,
      "trial_index": 5,
      "frame_service_ms": [
        10.1,
        10.1,
        10.1,
        10.1,
        10.1,
        10.1,
        10.1,
        10.1,
        10.1,
        10.1,
        10.1,
        10.1,
        10.1,
        10.1,
        10.1,
        10.1,
        10.1,
        10.1,
        10.1,
        10.1,
        10.1,
        10.1,
        10.1,
        10.1,
        10.1,
        10.1,
        10.1,
        10.1,
        10.1,
        10.1,
        10.1,
        10.1,
        10.1,
        10.1,
        10.1,
        10.1,
        10.1,
        10.1,
        10.1,
        10.1,
        10.1,
        10.1,
        10.1,
        10.1,
        10.1,
        10.1,
        10.1,
        10.1,
        10.1,
        10.1,
        10.1,
        10.1,
        10.1,
        10.1,
        10.1,
        10.1,
        10.1,
        10.1,
        10.1,
        10.1,
        10.1,
        10.1,
        10.1,
        10.1
      ]
    },
    {
      "agent_count": 50000,
      "trial_index": 6,
      "frame_service_ms": [
        10.12,
        10.12,
        10.12,
        10.12,
        10.12,
        10.12,
        10.12,
        10.12,
        10.12,
        10.12,
        10.12,
        10.12,
        10.12,
        10.12,
        10.12,
        10.12,
        10.12,
        10.12,
        10.12,
        10.12,
        10.12,
        10.12,
        10.12,
        10.12,
        10.12,
        10.12,
        10.12,
        10.12,
        10.12,
        10.12,
        10.12,
        10.12,
        10.12,
        10.12,
        10.12,
        10.12,
        10.12,
        10.12,
        10.12,
        10.12,
        10.12,
        10.12,
        10.12,
        10.12,
        10.12,
        10.12,
        10.12,
        10.12,
        10.12,
        10.12,
        10.12,
        10.12,
        10.12,
        10.12,
        10.12,
        10.12,
        10.12,
        10.12,
        10.12,
        10.12,
        10.12,
        10.12,
        10.12,
        10.12
      ]
    }
  ],
  "claimed": {
    "median_p95_ms": 10.06,
    "median_p99_ms": 10.06,
    "verdict": "pass"
  },
  "project_rust_alloc_count": 0,
  "submitted_frames": 100,
  "completed_frames": 100,
  "max_in_flight": 2
}
